{
  "schema_version": 1,
  "id": "fastback",
  "category": "automobile",
  "roles": [
    "hood",
    "front_bumper",
    "front_fender",
    "front_door",
    "rear_door",
    "rear_quarter",
    "roof",
    "windshield",
    "rear_glass",
    "a_pillar",
    "b_pillar",
    "c_pillar",
    "rocker",
    "rear_bumper",
    "wheel_arch",
    "wheel",
    "mirror",
    "headlight",
    "taillight"
  ],
  "optional_roles": [
    "trunk",
    "hatch"
  ],
  "minimum_iou": {
    "side": 0.94,
    "top": 0.92,
    "front": 0.92,
    "rear": 0.9
  }
}
